{
  "audit": {
    "analyst_causal_matched_resources": {
      "candidate_simulation_count_equal": true,
      "llm_call_count_equal": true,
      "masked_handoff": {
        "candidate_simulation_count": 360,
        "llm_call_count": 120,
        "window_count": 5
      },
      "multi_agent": {
        "candidate_simulation_count": 360,
        "llm_call_count": 120,
        "window_count": 5
      },
      "window_count_equal": true
    },
    "analyst_causal_pairwise_hierarchy": "worse",
    "analyst_causal_value_gate": "not_established",
    "conclusion": "All 35 record fingerprints, 35 deterministic repetition pairs, and 20 rolling hidden-future/state-handoff boundary gates verify exactly against the supplied evidence; per-arm hard-SLO pass counts and aggregate mean metrics match (means agree within floating-point representation), and the multi-Agent superiority, multi-Agent-vs-ordinary, and Analyst causal-value gates are all not_established on the supplied records.",
    "deterministic_repetition_verified_count": 35,
    "evidence_fingerprint_verified": true,
    "hard_slo_pass_counts": {
      "fixed-tenant-predictive": 2,
      "ordinary-fifo": 5,
      "posthoc-catalog-oracle": 5,
      "rolling-multi-agent": 3,
      "rolling-multi-agent-masked": 4,
      "rolling-single-agent": 3,
      "rolling-workload-rule": 4
    },
    "multi_agent_superiority_gate": "not_established",
    "multi_agent_vs_ordinary_gate": "not_established",
    "record_fingerprint_verified_count": 35,
    "rolling_boundary_verified_count": 20
  },
  "decision": {
    "analyst_causal_value_claim": "not_established",
    "approval_status": "approval_pending",
    "eligible_deployable_arm_ids": [
      "ordinary-fifo"
    ],
    "multi_agent_superiority_gate": "not_established",
    "multi_agent_vs_ordinary_gate": "not_established",
    "production_change_applied": false,
    "rationale": "After excluding posthoc-catalog-oracle and requiring hard_slo_pass_count == window_count, only ordinary-fifo (5/5 windows) is eligible, and all superiority and causal-value gates are not_established, so no deployment is approved.",
    "recommended_arm_id": "ordinary-fifo",
    "scheduling_superiority_claim": "not_established"
  },
  "evidence_fingerprint": "ccb6ec30822da0dfe54382aeff27815754d371e33c6f6dac22d5f266e047fd15",
  "human_approval": {
    "production_change_applied": false,
    "status": "approval_pending"
  },
  "llm_call_count": 2,
  "model_id": "deepseek-v4-flash",
  "project_id": "proj-20260812-190350",
  "receipt_fingerprint": "72b5c4435504bba2f238198dedc244e12cf351abb5fea05e8f4eb9487524d6c6",
  "schema_version": "schednav.rolling-agentteams-closeout/v1",
  "stages": {
    "manager": {
      "context_isolation_fingerprint": "ee9bebe086b2e1a51dfa2d8f6291cde444869373ba22ba957410c9f22000057a",
      "output_fingerprint": "0b5c9a3588e513f280e16fb0b65985f2c93132844765390b7ed7c59b255e381a",
      "role": "Manager",
      "task_id": "task-v3-20260813-closeout-manager",
      "worker_id": "schednav-manager"
    },
    "slo_auditor": {
      "context_isolation_fingerprint": "190c4e24b444947090f350c92b3daf229b0534457e0fdd000b7270a45fcca50f",
      "output_fingerprint": "c833412723f70f570d5a16fcf1b305323e14f4324697e937bbcb87234eab2595",
      "role": "SLO Auditor",
      "task_id": "task-v3-20260813-closeout-audit",
      "worker_id": "slo-auditor"
    }
  },
  "study_id": "rolling-ablation-v3"
}
